{
  "schema_version": "1.2",
  "tool": {
    "name": "FUSE",
    "version": "0.2.0"
  },
  "target": "esphome/devices.esphome.io",
  "scan": {
    "target_kind": "directory",
    "profile": "generic",
    "started_at": "2026-10-26T17:33:45Z",
    "completed_at": "2026-10-26T17:33:46Z",
    "input_manifest_sha256": "b5c022ed006e8f5a46538c06acdb1ca497bf98a11ed5cf02fa70feef8a08b7db"
  },
  "summary": {
    "files_discovered": 73,
    "files_selected": 73,
    "files_filtered": 0,
    "files_scanned": 73,
    "files_skipped": 0,
    "analysis_performed": true,
    "finding_count": 0,
    "severity_counts": {
      "critical": 0,
      "high": 0,
      "medium": 0,
      "low": 0,
      "info": 0,
      "unknown": 0
    }
  },
  "coverage": {
    "files_skipped_by_reason": {},
    "rules_available": [
      "FUSE001",
      "FUSE002",
      "FUSE003",
      "FUSE004",
      "FUSE005",
      "FUSE006",
      "FUSE007"
    ],
    "rules_enabled": [
      "FUSE001",
      "FUSE002",
      "FUSE003",
      "FUSE004",
      "FUSE005",
      "FUSE006",
      "FUSE007"
    ],
    "analyzers": [
      {
        "name": "fuse-native",
        "status": "completed",
        "version": "0.2.0",
        "detail": "Native rules completed.",
        "findings": 0
      }
    ]
  },
  "findings": [],
  "artifacts": []
}
